{
  "schemaVersion": "1.0.0",
  "effectSpecVersion": "1.0.0",
  "seed": 42,
  "label": "golden-magic-benchmark",
  "canvas": {
    "width": 1024,
    "height": 1024,
    "colorSpace": "srgb",
    "pixelAspectRatio": 1,
    "normalized": true
  },
  "references": [
    {
      "id": "effect_ref",
      "assetId": "asset_effect_ref_01",
      "role": "effect",
      "digest": "sha256:aaaaaaaaaaaaaaaaaaaaaaaaaaaaaaaaaaaaaaaaaaaaaaaaaaaaaaaaaaaaaaaa",
      "weight": 1
    }
  ],
  "guidance": {
    "anchors": [
      {
        "id": "anchor_center",
        "point": { "x": 0.5, "y": 0.42 },
        "radius": 0.18
      }
    ],
    "strength": 0.72,
    "subjectMaskAssetId": "asset_subject_mask_01",
    "notes": "benchmark fixture only"
  },
  "primitives": [
    {
      "id": "spark_curve",
      "kind": "curve",
      "enabled": true,
      "params": {
        "intensity": 0.8,
        "thickness": 0.03,
        "segments": 12
      }
    },
    {
      "id": "glow_volume",
      "kind": "volume",
      "enabled": true,
      "params": {
        "density": 0.35,
        "softness": 0.6
      }
    },
    {
      "id": "bloom_lens",
      "kind": "lens",
      "enabled": true,
      "params": {
        "threshold": 0.65,
        "radius": 0.12
      }
    }
  ],
  "benchmark": {
    "fixtureId": "bench_golden_magic",
    "description": "Labeled golden-magic benchmark fixture; not a product mode discriminator."
  }
}
